{"schema":"reclose-eap-v1","targetId":"reclose-target-003","policyHash":"0xa6d317b0bf867b3cb7e561d84a7338a12b662d7939092e7a8cc8cc2e1754b34b","ruleId":"PROVIDER_COMPROMISE_V1","subject":"Provider A credential compromise (R1 live proof, zero-bond, CONFIRMED)","reporter":"0x24fAe7cD031Ed702Be63BDeA8912141805B996bd","observedAt":"2026-09-12T05:45:05.059Z","sources":[{"sourceId":"genlayer-project-boilerplate","url":"https://raw.githubusercontent.com/genlayerlabs/genlayer-project-boilerplate/main/README.md","sourceClass":"INDEPENDENT_PUBLIC","extractedText":"Security bulletin: ProviderStubA operator private key was exposed in a public commit on 2026-09-12 and used by an unauthorized third party to submit unauthorized fulfill() calls. The operator has confirmed credential compromise and rotated keys. This is a confirmed, verified credential compromise, independently corroborated.","snapshotRef":"","retrievedAt":"2026-09-12T05:45:05.064Z","contentHash":"0xe45928cbed28d4a750a3242b38ab6705953056a32307b6bea6fd1dd0f80b44d2"}],"sourceClasses":["INDEPENDENT_PUBLIC"],"retrievedAt":"2026-09-12T05:45:05.064Z","contentHashes":["0xe45928cbed28d4a750a3242b38ab6705953056a32307b6bea6fd1dd0f80b44d2"],"snapshotRefs":[""],"artifactHash":"0xb689629b980c86f957059f6f0842437c7bca247f01d2ace348b5e178f85fb7bf"}